{
  "$schema": "https://json-schema.org/draft/2020-12/schema",
  "$id": "https://weaver-spec.dev/contracts/v0/extended/review_artifact.schema.json",
  "title": "ReviewArtifact",
  "description": "Extended. A minimal, language-neutral interchange shape for trace/review artifacts exchanged between Weaver-stack projects (context build records, execution records, policy decisions, review notes, safety reports). An interchange shape, not a storage system.",
  "x_weaver_stability": "stable",
  "type": "object",
  "required": ["artifact_id", "artifact_type", "source_project", "created_at"],
  "properties": {
    "artifact_id": {
      "type": "string",
      "minLength": 1,
      "description": "Unique identifier for this artifact."
    },
    "artifact_type": {
      "type": "string",
      "minLength": 1,
      "description": "Producer-defined kind of artifact, e.g. context_build, execution_record, policy_decision, review_note, safety_report."
    },
    "source_project": {
      "type": "string",
      "minLength": 1,
      "description": "Project that produced this artifact (e.g. contextweaver, agent-kernel, lessonweaver)."
    },
    "created_at": {
      "type": "string",
      "format": "date-time",
      "description": "ISO 8601 timestamp of when the artifact was created."
    },
    "subject_ref": {
      "type": ["string", "null"],
      "description": "Optional reference to the subject the artifact is about (e.g. a flow, capability, or commit)."
    },
    "summary": {
      "type": ["string", "null"],
      "description": "Optional short, human-readable summary."
    },
    "evidence_refs": {
      "type": "array",
      "items": { "type": "string" },
      "description": "References to supporting evidence (traces, payloads, logs)."
    },
    "decision_refs": {
      "type": "array",
      "items": { "type": "string" },
      "description": "References to decisions associated with this artifact (e.g. PolicyDecision IDs)."
    },
    "metadata": {
      "type": "object",
      "description": "Optional implementation-specific metadata. Namespace project-specific keys.",
      "additionalProperties": true
    }
  },
  "additionalProperties": true
}
